[
  {
    "title": "Every Stephen King Book I've Read, Ranked",
    "date": "2026-10-05",
    "tags": [
      "books"
    ],
    "category": "Books & Media",
    "excerpt": "Every Stephen King book I've read, ranked: ten books from The Shining to It, by someone who rates King below his own average but keeps going back.",
    "url": "blog/stephen-king-ranked.html",
    "image": "blog/img/stephen-king/king-house-card.webp",
    "readMinutes": 11,
    "words": 2310
  },
  {
    "title": "Sleep Science",
    "date": "2026-09-27",
    "tags": [
      "science",
      "advice"
    ],
    "category": "Ideas",
    "excerpt": "Sleep matters, and the sleep-influencer economy inflates certainty far past the evidence. What's solid, what's oversold, and why tracking sleep can ruin it.",
    "url": "blog/sleep-science.html",
    "image": "img/photography/thumb/441.webp",
    "series": {
      "name": "Wellness From the Science",
      "part": 1
    },
    "readMinutes": 9,
    "words": 1921
  },
  {
    "title": "What a Custom Domain Actually Involves",
    "date": "2026-09-27",
    "tags": [
      "technology",
      "advice"
    ],
    "category": "Technology",
    "excerpt": "The custom domain takes about twenty minutes. Registrars, DNS records, HTTPS, and email at your own address, demystified.",
    "url": "blog/what-a-custom-domain-actually-involves.html",
    "image": "img/photography/thumb/42.webp",
    "series": {
      "name": "How This Site Is Built",
      "part": 18
    },
    "readMinutes": 6,
    "words": 1300
  },
  {
    "title": "A Headline That Evolves Itself",
    "date": "2026-09-26",
    "tags": [
      "technology"
    ],
    "category": "Technology",
    "excerpt": "The homepage headline is a hill climber painting 78 triangles until they read Hi, I'm Ken.",
    "url": "blog/a-headline-that-evolves-itself.html",
    "image": "blog/img/headline/evolved-headline-card.webp",
    "series": {
      "name": "How This Site Is Built",
      "part": 17
    },
    "readMinutes": 5,
    "words": 948,
    "code": true
  },
  {
    "title": "The Inaccessibility of Photography",
    "date": "2026-09-26",
    "tags": [
      "photography"
    ],
    "category": "Photography",
    "excerpt": "The gear treadmill makes photography look expensive, but most of my gallery was shot on a camera that now sells used from about a hundred dollars, and my phone.",
    "url": "blog/the-inaccessibility-of-photography.html",
    "updated": "2026-10-12",
    "image": "img/photography/thumb/501.webp",
    "readMinutes": 8,
    "words": 1695
  },
  {
    "title": "Every Card Has a Sketch",
    "date": "2026-09-20",
    "tags": [
      "technology"
    ],
    "category": "Technology",
    "excerpt": "Move your mouse over a card on the blog and the cover starts doing something. How the sketches work.",
    "url": "blog/every-card-has-a-sketch.html",
    "image": "img/photography/hero/204.webp",
    "series": {
      "name": "How This Site Is Built",
      "part": 16
    },
    "readMinutes": 4,
    "words": 800,
    "code": true
  },
  {
    "title": "Hyper-Heuristics, Live",
    "date": "2026-09-19",
    "tags": [
      "ai"
    ],
    "category": "Data & AI",
    "excerpt": "A hyper-heuristic timetabling exams live in your browser: four move heuristics compete for a learning manager's attention while a Great Deluge water level drains.",
    "url": "blog/hyper-heuristics-live.html",
    "image": "blog/img/hyperheuristics/hyperheuristics-hero.webp",
    "series": {
      "name": "Algorithms, Live",
      "part": 10
    },
    "readMinutes": 9,
    "words": 1956,
    "interactive": true
  },
  {
    "title": "Photographing Strangers",
    "date": "2026-09-16",
    "tags": [
      "photography",
      "philosophy"
    ],
    "category": "Photography",
    "excerpt": "Street photography is legal in most places and comfortable in almost none of them. Where the law actually lands across 52 jurisdictions, and the four tests I use before I raise a camera at someone.",
    "url": "blog/photographing-strangers.html",
    "image": "img/photography/thumb/275.webp",
    "readMinutes": 7,
    "words": 1433
  },
  {
    "title": "Ruin and Recreate, Live",
    "date": "2026-09-13",
    "tags": [
      "data science"
    ],
    "category": "Data Science",
    "excerpt": "Most search algorithms improve a solution by nudging it. Ruin and recreate demolishes part of it and rebuilds, which works better on rosters. The method behind my 2018 rostering paper, running in your browser.",
    "url": "blog/ruin-and-recreate-live.html",
    "image": "blog/img/ruin/ruin-hero.webp",
    "series": {
      "name": "Research, Live",
      "part": 3
    },
    "readMinutes": 9,
    "words": 1777,
    "interactive": true
  },
  {
    "title": "Leading a Horse to Water",
    "date": "2026-09-06",
    "tags": [
      "advice"
    ],
    "category": "Ideas",
    "excerpt": "You give feedback to a colleague. They thank you for it, and a week later nothing has changed. Three checks before you push harder, one change of approach, a budget, and a date.",
    "url": "blog/leading-a-horse-to-water.html",
    "image": "img/photography/thumb/439.webp",
    "series": {
      "name": "Feedback",
      "part": 1
    },
    "readMinutes": 15,
    "words": 3166
  },
  {
    "title": "Making This Website Accessible",
    "date": "2026-08-30",
    "tags": [
      "technology"
    ],
    "category": "Technology",
    "excerpt": "Thirty small habits keep this site accessible: a skip link, screen-reader notes on new-tab links, reduced-motion fallbacks, and an audit that catches the many that I forget along the way.",
    "url": "blog/making-this-website-accessible.html",
    "image": "img/photography/thumb/367.webp",
    "series": {
      "name": "How This Site Is Built",
      "part": 15
    },
    "readMinutes": 6,
    "words": 1146,
    "code": true
  },
  {
    "title": "The Availability Heuristic Runs the News",
    "date": "2026-08-30",
    "tags": [
      "philosophy",
      "science"
    ],
    "category": "Ideas",
    "excerpt": "We judge likelihood by how easily examples come to mind, so we fear the vivid and rare and shrug at the common and deadly. Why the news makes us afraid of the wrong things.",
    "url": "blog/the-availability-heuristic-runs-the-news.html",
    "image": "img/photography/thumb/63.webp",
    "series": {
      "name": "Cognitive Biases",
      "part": 2
    },
    "readMinutes": 6,
    "words": 1221
  },
  {
    "title": "Confirmation Bias Is the Mother Bias",
    "date": "2026-08-28",
    "tags": [
      "philosophy",
      "science"
    ],
    "category": "Ideas",
    "excerpt": "Confirmation bias is the bias under the biases. Why it's the hardest to fix, why smart people are worse, and there might be something that can help us.",
    "url": "blog/confirmation-bias-is-the-mother-bias.html",
    "image": "img/photography/thumb/66.webp",
    "series": {
      "name": "Cognitive Biases",
      "part": 1
    },
    "readMinutes": 7,
    "words": 1527
  },
  {
    "title": "Tabu Search, Live",
    "date": "2026-08-26",
    "tags": [
      "ai"
    ],
    "category": "Data & AI",
    "excerpt": "An interactive tabu search in your browser: watch a search with a memory solve N-Queens live, ban its own best moves, and escape the traps that stop every other method in this series.",
    "url": "blog/tabu-search-live.html",
    "image": "blog/img/tabu/tabu-hero.webp",
    "series": {
      "name": "Algorithms, Live",
      "part": 9
    },
    "readMinutes": 8,
    "words": 1752,
    "interactive": true
  },
  {
    "title": "Genetic Programming, Live",
    "date": "2026-08-23",
    "tags": [
      "ai"
    ],
    "category": "Data & AI",
    "excerpt": "Genetic programming in your browser: watch a population of expression trees evolve to fit a hidden curve, read the best program as it grows, and give it bloat with the sliders.",
    "url": "blog/genetic-programming-live.html",
    "image": "blog/img/gp/gp-hero.webp",
    "series": {
      "name": "Algorithms, Live",
      "part": 8
    },
    "readMinutes": 9,
    "words": 1822,
    "interactive": true
  },
  {
    "title": "Differential Evolution, Live",
    "date": "2026-08-22",
    "tags": [
      "ai"
    ],
    "category": "Data & AI",
    "excerpt": "Differential evolution running live in your browser: a population whose own spread sets its step size hunts minima on four landscapes.",
    "url": "blog/differential-evolution-live.html",
    "image": "blog/img/diffevo/diffevo-hero.webp",
    "series": {
      "name": "Algorithms, Live",
      "part": 7
    },
    "readMinutes": 9,
    "words": 1772,
    "interactive": true
  },
  {
    "title": "CMA-ES, Live",
    "date": "2026-08-19",
    "tags": [
      "ai"
    ],
    "category": "Data & AI",
    "excerpt": "CMA-ES live in your browser: watch an optimiser learn the shape of a valley by stretching and rotating its search cloud until the narrow floor costs it nothing to walk along.",
    "url": "blog/cma-es-live.html",
    "image": "blog/img/cmaes/cmaes-hero.webp",
    "series": {
      "name": "Algorithms, Live",
      "part": 6
    },
    "readMinutes": 7,
    "words": 1379,
    "interactive": true
  },
  {
    "title": "Factorio, Live: a Game as an Optimisation Benchmark",
    "date": "2026-08-16",
    "tags": [
      "data science"
    ],
    "category": "Data Science",
    "excerpt": "The logistic transport belt problem from my GECCO 2021 paper, running live in your browser: watch simulated annealing and genetic programming lay belts across a walled grid until the items get through.",
    "url": "blog/factorio-live.html",
    "image": "blog/img/factorio-belt-demo.png",
    "series": {
      "name": "Research, Live",
      "part": 2
    },
    "readMinutes": 12,
    "words": 2470,
    "interactive": true
  },
  {
    "title": "How the Interactive Posts Work",
    "date": "2026-08-16",
    "tags": [
      "technology"
    ],
    "category": "Technology",